{
  "version": 1,
  "mode": "merge",
  "exportedAt": "2026-06-10T00:00:00Z",
  "groups": [
    {
      "name": "BLACKPINK",
      "type": "female",
      "active": true,
      "aliases": ["블랙핑크"],
      "artists": [
        {
          "name": "Jisoo",
          "aliases": ["김지수"],
          "membership": {
            "activityType": "group",
            "status": "active",
            "from": "2016-06-15",
            "isPrimary": true
          },
          "songs": []
        },
        {
          "name": "Jennie",
          "aliases": ["제니"],
          "membership": {
            "activityType": "group",
            "status": "active",
            "from": "2016-06-15",
            "isPrimary": true
          },
          "songs": []
        },
        {
          "name": "Rosé",
          "aliases": ["로제"],
          "membership": {
            "activityType": "group",
            "status": "active",
            "from": "2016-06-15",
            "isPrimary": true
          },
          "songs": []
        },
        {
          "name": "Lisa",
          "aliases": ["리사"],
          "membership": {
            "activityType": "group",
            "status": "active",
            "from": "2016-06-15",
            "isPrimary": true
          },
          "songs": []
        }
      ],
      "songs": [
        { "title": "Shut Down", "aliases": [] },
        { "title": "Pink Venom", "aliases": [] },
        { "title": "DDU-DU DDU-DU", "aliases": [] },
        { "title": "Kill This Love", "aliases": [] },
        { "title": "Whistle", "aliases": [] },
        { "title": "Boombayah", "aliases": [] },
        { "title": "Playing with Fire", "aliases": [] },
        { "title": "Lovesick Girls", "aliases": [] },
        { "title": "Ice Cream", "aliases": [] },
        { "title": "As If It's Your Last", "aliases": [] },
        { "title": "Square One", "aliases": [] },
        { "title": "Bet You Wanna", "aliases": [] },
        { "title": "Kick It", "aliases": [] },
        { "title": "The Girls", "aliases": [] },
        { "title": "Hard to Love", "aliases": [] },
        { "title": "Ready for Love", "aliases": [] },
        { "title": "Tally", "aliases": [] },
        { "title": "Pretty Savage", "aliases": [] },
        { "title": "Crazy Over You", "aliases": [] },
        { "title": "Tally", "aliases": [] }
      ]
    },
    {
      "name": "TWICE",
      "type": "female",
      "active": true,
      "aliases": ["트와이스"],
      "artists": [
        {
          "name": "Nayeon",
          "aliases": ["나연"],
          "membership": {
            "activityType": "group",
            "status": "active",
            "from": "2015-10-20",
            "isPrimary": true
          },
          "songs": []
        },
        {
          "name": "Jeongyeon",
          "aliases": ["정연"],
          "membership": {
            "activityType": "group",
            "status": "active",
            "from": "2015-10-20",
            "isPrimary": true
          },
          "songs": []
        },
        {
          "name": "Momo",
          "aliases": ["모모"],
          "membership": {
            "activityType": "group",
            "status": "active",
            "from": "2015-10-20",
            "isPrimary": true
          },
          "songs": []
        },
        {
          "name": "Sana",
          "aliases": ["사나"],
          "membership": {
            "activityType": "group",
            "status": "active",
            "from": "2015-10-20",
            "isPrimary": true
          },
          "songs": []
        },
        {
          "name": "Jihyo",
          "aliases": ["지효"],
          "membership": {
            "activityType": "group",
            "status": "active",
            "from": "2015-10-20",
            "isPrimary": true
          },
          "songs": []
        },
        {
          "name": "Mina",
          "aliases": ["미나"],
          "membership": {
            "activityType": "group",
            "status": "active",
            "from": "2015-10-20",
            "isPrimary": true
          },
          "songs": []
        },
        {
          "name": "Dahyun",
          "aliases": ["다현"],
          "membership": {
            "activityType": "group",
            "status": "active",
            "from": "2015-10-20",
            "isPrimary": true
          },
          "songs": []
        },
        {
          "name": "Chaeyoung",
          "aliases": ["채영"],
          "membership": {
            "activityType": "group",
            "status": "active",
            "from": "2015-10-20",
            "isPrimary": true
          },
          "songs": []
        },
        {
          "name": "Tzuyu",
          "aliases": ["쯔위"],
          "membership": {
            "activityType": "group",
            "status": "active",
            "from": "2015-10-20",
            "isPrimary": true
          },
          "songs": []
        }
      ],
      "songs": [
        { "title": "Fancy", "aliases": [] },
        { "title": "Knock Knock", "aliases": [] },
        { "title": "What is Love", "aliases": [] },
        { "title": "Cheer Up", "aliases": [] },
        { "title": "TT", "aliases": [] },
        { "title": "Signal", "aliases": [] },
        { "title": "Likey", "aliases": [] },
        { "title": "DNA", "aliases": [] },
        { "title": "Heart Shaker", "aliases": [] },
        { "title": "YES or YES", "aliases": [] },
        { "title": "Feel Special", "aliases": [] },
        { "title": "I CAN'T STOP ME", "aliases": [] },
        { "title": "Alcohol-Free", "aliases": [] },
        { "title": "Formula of Love", "aliases": [] }
      ]
    },
    {
      "name": "EXO",
      "type": "male",
      "active": true,
      "aliases": ["엑소"],
      "artists": [
        {
          "name": "Suho",
          "aliases": ["수호"],
          "membership": {
            "activityType": "group",
            "status": "active",
            "from": "2012-04-08",
            "isPrimary": true
          },
          "songs": []
        },
        {
          "name": "Xiumin",
          "aliases": ["시우민"],
          "membership": {
            "activityType": "group",
            "status": "active",
            "from": "2012-04-08",
            "isPrimary": true
          },
          "songs": []
        },
        {
          "name": "Lay",
          "aliases": ["레이"],
          "membership": {
            "activityType": "group",
            "status": "active",
            "from": "2012-04-08",
            "isPrimary": true
          },
          "songs": []
        },
        {
          "name": "Baekhyun",
          "aliases": ["백현"],
          "membership": {
            "activityType": "group",
            "status": "active",
            "from": "2012-04-08",
            "isPrimary": true
          },
          "songs": []
        },
        {
          "name": "Chen",
          "aliases": ["첸"],
          "membership": {
            "activityType": "group",
            "status": "active",
            "from": "2012-04-08",
            "isPrimary": true
          },
          "songs": []
        },
        {
          "name": "Chanyeol",
          "aliases": ["찬열"],
          "membership": {
            "activityType": "group",
            "status": "active",
            "from": "2012-04-08",
            "isPrimary": true
          },
          "songs": []
        },
        {
          "name": "D.O.",
          "aliases": ["디오"],
          "membership": {
            "activityType": "group",
            "status": "active",
            "from": "2012-04-08",
            "isPrimary": true
          },
          "songs": []
        },
        {
          "name": "Kai",
          "aliases": ["카이"],
          "membership": {
            "activityType": "group",
            "status": "active",
            "from": "2012-04-08",
            "isPrimary": true
          },
          "songs": []
        },
        {
          "name": "Sehun",
          "aliases": ["세훈"],
          "membership": {
            "activityType": "group",
            "status": "active",
            "from": "2012-04-08",
            "isPrimary": true
          },
          "songs": []
        }
      ],
      "songs": [
        { "title": "Growl", "aliases": [] },
        { "title": "Call Me Baby", "aliases": [] },
        { "title": "Love Me Right", "aliases": [] },
        { "title": "Monster", "aliases": [] },
        { "title": "Lucky One", "aliases": [] },
        { "title": "Artificial Love", "aliases": [] },
        { "title": "For Life", "aliases": [] },
        { "title": "Ko Ko Bop", "aliases": [] },
        { "title": "Power", "aliases": [] },
        { "title": "Tempo", "aliases": [] },
        { "title": "Obsession", "aliases": [] },
        { "title": "Don't Fight The Feeling", "aliases": [] },
        { "title": "Cream Soda", "aliases": [] },
        { "title": "Superpowers", "aliases": [] }
      ]
    },
    {
      "name": "Red Velvet",
      "type": "female",
      "active": true,
      "aliases": ["레드벨벳"],
      "artists": [
        {
          "name": "Irene",
          "aliases": ["아이린"],
          "membership": {
            "activityType": "group",
            "status": "active",
            "from": "2014-08-01",
            "isPrimary": true
          },
          "songs": []
        },
        {
          "name": "Seulgi",
          "aliases": ["슬기"],
          "membership": {
            "activityType": "group",
            "status": "active",
            "from": "2014-08-01",
            "isPrimary": true
          },
          "songs": []
        },
        {
          "name": "Wendy",
          "aliases": ["웬디"],
          "membership": {
            "activityType": "group",
            "status": "active",
            "from": "2014-08-01",
            "isPrimary": true
          },
          "songs": []
        },
        {
          "name": "Joy",
          "aliases": ["조이"],
          "membership": {